candidate,tweet_time,tweet_text,tweet_lang
BernieSanders,2016-03-10 18:54:08,"RT @cascamike: .@washingtonpost: ""5 times hillary clinton has played fast and loose with the facts on bernie sanders’ record.” https://t.co…",en
BernieSanders,2016-03-10 18:36:47,PolitiFact: Hillary Clinton wrongly says Bernie Sanders wants to delay the Clean Power Plan https://t.co/w04bNZaLRW,en
BernieSanders,2016-03-10 18:23:06,I hope one day Republicans can overcome the needs of their campaign contributors and worry instead about the planet they're leaving behind.,en
BernieSanders,2016-03-10 15:54:29,RT @maryaliceparks: Watch @BernieSanders Gainesville rally live https://t.co/11Zdr6aDGI @UF University of Florida https://t.co/QVzeVpYBuc,en
BernieSanders,2016-03-10 14:46:06,This campaign is not a billionaire-funded campaign. It is a people’s campaign.,en
BernieSanders,2016-03-10 13:54:01,"We have got to tell corporate America they cannot continue to abandon workers in the U.S. We've lost 60,000 factories since 2001.",en
BernieSanders,2016-03-10 05:02:12,"This is why I am running for President of the United States of America. #DebateWithBernie
https://t.co/7oH2ouerx5",en
BernieSanders,2016-03-10 03:29:10,"Bernie votó contra la guerra de Irak y cambiar el régimen en Libia porque temía lo que sucedería después. Desafortunadamente, él tuvo razón.",es
BernieSanders,2016-03-10 03:27:35,Sec. Clinton is arguing that the U.S. should continue to be the only major country that doesn't guarantee health care to all people.,en
BernieSanders,2016-03-10 03:27:05,Only one candidate has a plan to get to universal health care coverage. How would @HillaryClinton get there? #UnivisionDebate,en
BernieSanders,2016-03-10 03:21:45,"Why does @HillaryClinton think it's okay for Trump's kids to go to elementary, middle, and high schools for free, but not colleges?",en
BernieSanders,2016-03-10 03:17:31,"Bernie voted against the Iraq War and regime change in Libya because he feared what would happen the day after. Unfortunately, he was right.",en
BernieSanders,2016-03-10 03:08:31,"Necesitamos una economía que funcione para todos, no sólo para un puñado de multimillonarios. #UnivisionDebate
https://t.co/uanLmkToyX",es
BernieSanders,2016-03-10 03:04:50,"El director de Goldman Sachs no me dio $250,000; al contrario, dijo que soy un peligro. Y tiene razón — soy un peligro para Wall Street.",es
BernieSanders,2016-03-10 03:04:14,"The head of Goldman Sachs didn’t give Bernie $225,000 for a speech. He said Bernie would be dangerous for Wall Street. And he’s right.",en
BernieSanders,2016-03-10 03:00:38,There is nobody in the United States Congress who has taken on the Koch Brothers more than Bernie Sanders. #UnivisionDebate,en
BernieSanders,2016-03-10 02:59:07,"Video from that Clinton speech telling Wall St to ""cut it out"" shows her greeting ""wonderful donors"" in the room. https://t.co/314TkAqqLJ",en
BernieSanders,2016-03-10 02:52:03,Let's stop the racism. Let's stop the xenophobia. Let's stop Trump. #DemDebate,en
BernieSanders,2016-03-10 02:51:50,RT @davidaxelrod: She did it again and I'll say it again. It's misleading to imply that TARP II was an auto bailout bill. #DemDebate,en
BernieSanders,2016-03-10 02:50:11,"Bernie’s immigration plan is the gold standard. ""We hope [Hillary] is inspired to match his boldness.” -@nytimes https://t.co/LwZPIpIJeG",en
BernieSanders,2016-03-10 02:46:40,"""The banks of NY and our other financial institutions are probably the biggest winners."" - @HillaryClinton on the ""auto"" bailout in 2008.",en
BernieSanders,2016-03-10 02:43:58,".@HillaryClinton doubles down on ""negative tactics"" and dishonesty described earlier by The New York Times: https://t.co/dfOag8mP01",en
BernieSanders,2016-03-10 02:43:01,"RT @julito77: ""Madam Secretary, I would match my record against yours any day of the week."" @BernieSanders #DemDebate",en
BernieSanders,2016-03-10 02:42:03,No deportaré a niños que viven en Estados Unidos de América. Eso lo puedo prometer. #DemDebate,es
BernieSanders,2016-03-10 02:39:42,“We have laws.” - @HillaryClinton #DemDebate https://t.co/OyheqgUGzw,en
BernieSanders,2016-03-10 02:39:01,I will not deport children from the United States of America. I can make that promise.  #DemDebate,en
BernieSanders,2016-03-10 02:34:28,"""Clinton acknowledged that, in some cases, a child’s deportation could bring them great harm."" https://t.co/xAuAhf4PYo #DemDebate",en
BernieSanders,2016-03-10 02:32:19,"“Como presidenta, yo me opondré a darle licencias de conducir a personas indocumentadas…” — @HillaryClinton en 2007. #DemDebate",es
BernieSanders,2016-03-10 02:28:28,"""As president, I will not support driver’s licenses for undocumented people..."" - @HillaryClinton in 2007",en
BernieSanders,2016-03-10 02:27:27,"Bernie’s guiding light on the issue of immigration reform: keeping families together, not dividing them up.
https://t.co/ExVZjpyDna",en
BernieSanders,2016-03-10 02:21:42,"""I am, you know, adamantly against illegal immigration.” - @HillaryClinton.
https://t.co/XyBZfjGyqP",en
BernieSanders,2016-03-10 02:18:36,Cuando iniciamos estábamos 50 puntos detrás de la “nominada demócrata inevitable”. Ahora esa candidata no se ve tan inevitable. #DemDebate,es
BernieSanders,2016-03-10 02:16:05,When we began we were 50 points behind the “inevitable Democratic nominee.” Now that inevitable candidate ain't so inevitable. #DemDebate,en
BernieSanders,2016-03-10 02:02:39,Bernie is about to walk on stage for the #DemDebate in Miami. Tune in live here https://t.co/IVyHjFZvyP and #DebateWithBernie.,en
BernieSanders,2016-03-10 02:02:03,Bernie está a punto de subir al escenario del #DemDebate en Miami. Míralo en https://t.co/ApMLeDwN7r y participa usando #DebateWithBernie.,es
BernieSanders,2016-03-10 01:20:39,I stand with Chicago teachers. We shouldn't close schools and lay off teachers to reward Wall Street. https://t.co/4EH0myWyzw,en
BernieSanders,2016-03-09 23:54:02,The pharmaceutical industry has become a health hazard for the American people. We pay the highest prices for prescription drugs.,en
BernieSanders,2016-03-09 22:11:01,Some people say young people are apathetic. It seems to me like they are ready to transform America.,en
BernieSanders,2016-03-09 21:09:07,I hope Utah repeals the death penalty. There's enough violence in the world and the  government shouldn't add to it. https://t.co/WzzdLIFgJZ,en
BernieSanders,2016-03-09 20:53:03,"Multinational corporations making billions, moving jobs overseas, are asking for handouts from our middle class? I don't think so.",en
BernieSanders,2016-03-09 20:40:58,RT @Univision23: No se pierdan nuestro debate esta noche en @Univision. #DemDebate https://t.co/mM0tpKb7sg,es
BernieSanders,2016-03-09 20:34:47,"RT @rbecker51: On behalf of @BernieSanders, shukran jazilan! https://t.co/pN6JYx40lt",en
BernieSanders,2016-03-09 19:21:06,The wealthiest country in history has gotta get its priorities right. That's taking care of its people. Not more tax breaks for the rich.,en
BernieSanders,2016-03-09 17:29:49,"RT @MSNBC: .@BernieSanders: ""I don't give speeches behind closed doors to Goldman Sachs and I'm very proud of that"" https://t.co/zB3ql7cYjg",en
BernieSanders,2016-03-09 17:27:43,".@FLGovScott, veto this bill. Don’t play politics with abortion.  https://t.co/ufhPOuj8DI",en
BernieSanders,2016-03-09 17:17:58,RT @l4nguyen: .@BenJealous for @BernieSanders' push for fed-state partnership to allow reinvestment in public higher ed #SaveCSU https://t.…,en
BernieSanders,2016-03-09 16:52:04,"Since I have been an elected official, I have used my influence to stand with those who have no power, and to take on the ruling class.",en
BernieSanders,2016-03-09 15:48:06,What kind of morality is it when Congress gives tax breaks to billionaires but cuts nutrition programs that serve kids?,en
BernieSanders,2016-03-09 14:56:36,At the end of the day big money doesn’t always win. What we are showing is that millions of people agree with us.,en
BernieSanders,2016-03-09 14:04:06,"Greed is the religion of the billionaire class. A nation based on that kind of greed will not survive morally, economically or politically.",en
BernieSanders,2016-03-09 04:43:18,"The corporate media counted us out. The pollsters said we were way behind. But we won. Thank you, Michigan. https://t.co/Iywg9N3B1z",en
BernieSanders,2016-03-09 02:37:03,"While millions of Americans are just one paycheck away from economic devastation, the wealthy have never had it so good.",en
BernieSanders,2016-03-09 01:21:29,"Michigan: if you’re in line to vote, you have a right to vote. Stay in line and make your voice heard.",en
BernieSanders,2016-03-09 01:08:17,There is no reason why women should be paid significantly less than men. It’s sexism and it has got to end. https://t.co/L5BOkmpbrB,en
BernieSanders,2016-03-09 00:58:17,Love always trumps hate. https://t.co/B8R8nyCNNx,en
BernieSanders,2016-03-09 00:54:43,"This is what we can learn from history: when people stand together, there is nothing we cannot accomplish. https://t.co/VmMgZG6sw6",en
BernieSanders,2016-03-09 00:30:12,Watch Bernie in Miami live right now: https://t.co/Qi36R9CY6M,en
BernieSanders,2016-03-09 00:15:24,Standing up for our LGBTQ sisters and brothers is the duty of all elected officials. This should make us all proud. https://t.co/r4Rw5xInA8,en
BernieSanders,2016-03-08 23:57:25,African-American women earn just 60 cents for every dollar a white male earns. The figure for Latina women is just 55 cents. #IWD2016,en
BernieSanders,2016-03-08 22:37:06,Michigan and Mississippi — not sure where to vote? That's OK! Look up your polling location at https://t.co/ZaoGzRK1GS.,en
BernieSanders,2016-03-08 21:37:07,We must ensure pay equity for women workers. Equal pay for equal work — it's not a radical idea. #InternationalWomensDay,en
BernieSanders,2016-03-08 21:02:02,Voting for Bernie in Michigan or Mississippi? Use #iVoted and share this image! https://t.co/idCH9q6VOQ,en
BernieSanders,2016-03-08 20:27:01,We must end the international embarrassment of being the only major country that doesn't guarantee paid leave.  #InternationalWomensDay,en
BernieSanders,2016-03-08 20:00:15,"This is why it's so important that our Democratic debate moderators #AskAboutAbortion. 
https://t.co/sCxeoaCllx",en
BernieSanders,2016-03-08 19:42:07,To our supporters abroad: today is your last chance to vote in the Global Primary. Submit your ballot by 6PM ET. https://t.co/daOQQk7Mti,en
BernieSanders,2016-03-08 19:19:04,Ready for a political revolution? Get out and vote! Text VOTE to 82623 for voting information. #GOTVforBernie https://t.co/3akTyct7xL,en
BernieSanders,2016-03-08 19:09:03,Change cannot take place without political participation.,en
BernieSanders,2016-03-08 18:58:02,Michigan y Mississippi — Llegó tu turno para participar en nuestro movimiento. ¡Lleva a tu familia y amigos a votar!,es
BernieSanders,2016-03-08 18:28:50,Hillary Clinton on refugee children from Central America in June of 2014: https://t.co/1jRHfvtrgo,en
BernieSanders,2016-03-08 18:13:53,"Hillary Clinton on refugee children from Central America in June of 2014: ""They should be sent back."" https://t.co/nmDoWgLOUW",en
BernieSanders,2016-03-08 18:07:15,"The decision to have an abortion is a right of any woman, without interference from politicians.  #InternationalWomensDay",en
BernieSanders,2016-03-08 17:37:39,What this campaign is about is bringing people together. Michigan and Mississippi: please go vote today. https://t.co/pboxzWGLvo,en
BernieSanders,2016-03-08 16:20:31,"We need your help today! When you vote, ask a poll worker for your precinct's turnout number and report it: https://t.co/hhT0CRTzHg.",en
BernieSanders,2016-03-08 15:37:07,"Many people think Congress regulates Wall Street, but in fact it's Wall Street that regulates Congress.",en
BernieSanders,2016-03-08 14:15:51,Michigan and Mississippi — It's your turn to vote for our political revolution. Grab your friends and family and go out and vote.,en
BernieSanders,2016-03-08 13:35:03,"Americans shouldn't have to live in fear that they'll go bankrupt if they get sick. Health care must be a right, not a privilege.",en
BernieSanders,2016-03-08 04:07:06,We can't just take incremental steps to combat climate change. We've got to be bold because the future of our planet depends on it.,en
BernieSanders,2016-03-08 02:54:02,There is so much violence in our world today. I just don't think the state should add to it. That's one reason I oppose the death penalty.,en
BernieSanders,2016-03-08 01:33:07,I believe firmly that we can accomplish great things in this country if millions of Americans begin to stand up and fight for real change.,en
BernieSanders,2016-03-08 01:09:10,RT @MMFlint: Here it is from Forbes: Bernie was for the auto bailout but against the Wall Street bailout: https://t.co/mZPp3uiEiT.,en
BernieSanders,2016-03-08 00:12:03,Our movement is about creating an America that ensures nobody working 40 hours a week has to live in poverty.,en
BernieSanders,2016-03-07 23:46:16,"Bottom line: with ISIS in Libya, the 2011 intervention made us less safe. You don’t get extra points for good intentions.",en
BernieSanders,2016-03-07 23:39:35,It took @FoxNews to ask the first question about abortion at a Democratic town hall or debate. #DemTownHall,en
BernieSanders,2016-03-07 23:10:54,"RT @Sam_Frizell: Sanders: I believe health care is a right of all people.
Baier: Excuse me, where did that right come from?
Sanders: Being …",en
BernieSanders,2016-03-07 20:50:08,"In a democratic society, politics should not be treated like a baseball game or a soap opera. We need a serious discussion about the issues.",en
BernieSanders,2016-03-07 20:10:12,"When forced to defend a record of supporting bad trade deals, sometimes you say things that just aren't correct. https://t.co/n6g6RfqUeY",en
BernieSanders,2016-03-07 19:47:43,"Last night, @HillaryClinton went out of her way to mischaracterize my vote on the auto bailout. https://t.co/n6g6Rf9jnq",en
BernieSanders,2016-03-07 19:46:41,RT @nickconfessore: Clinton's answer on fracking vs. Sanders' answer. https://t.co/MsPWMXB00a,en
BernieSanders,2016-03-07 18:18:32,RT @jonathanoosting: Another big line for @BernieSanders in Dearborn https://t.co/PnYkjNhDKJ,en
BernieSanders,2016-03-07 18:15:30,"The right to vote is at the heart of freedom and equality in America, and the effort to suppress it must be met by fierce resistance.",en
BernieSanders,2016-03-07 18:08:19,"But to this day there are efforts by Republicans to make it harder for African-Americans, low-income people and senior citizens to vote.",en
BernieSanders,2016-03-07 16:47:01,"From the @WashingtonPost: ""Sanders is actually on the record as supporting the auto bailout. He even voted for it.""
https://t.co/Lx9iypxFo3",en
BernieSanders,2016-03-07 16:01:45,RT @jonodiener: Michigan friends! @BernieSanders rally TODAY in Ann Arbor and music from @nateruessmusic and @JRJRmusic! GO! https://t.co/4…,en
BernieSanders,2016-03-07 15:58:09,"RT @tomlobianco: ""Share that speech with the American people!"" @BernieSanders pressing @HillaryClinton for Goldman Sachs speeches",en
BernieSanders,2016-03-07 15:53:03,"The reality is that Congress doesn’t regulate Wall Street. Wall Street, its lobbyists and their billions of dollars regulate Congress.",en
BernieSanders,2016-03-07 14:49:28,"The system is rigged when the average person works longer hours for lower wages, and 58 percent of all new income goes to the top 1 percent.",en
BernieSanders,2016-03-07 03:15:52,"Tonight proved once again that we are well on our way towards winning this Democratic primary. Thank you, Maine!  https://t.co/LA5bXw8z95",en
BernieSanders,2016-03-07 03:03:18,RT @HillaryClinton: Another way we can help the kids and families of Flint: donate what you can to https://t.co/XKJUx3KplA. #DemDebate http…,en
BernieSanders,2016-03-07 02:51:04,RT @kenvogel: Hillary―boasting about all her donors―has raised 17% of her $ from small donors. Bernie raised 70% from small donors https://…,en
BernieSanders,2016-03-07 02:49:51,We all know my opponent has a very large super PAC. We fundraise a different way. Chip in: https://t.co/uaLlTZf4s5 #DemDebate,en
BernieSanders,2016-03-07 02:42:18,"If you care about clean water in Flint, how can you turn around and support fracking? #DemDebate",en
BernieSanders,2016-03-07 02:40:10,"Safe fracking is like clean coal, pure fiction. #DemDebate",en
BernieSanders,2016-03-07 02:39:34,Bernie doesn't ever support fracking. @HillaryClinton does. Big difference. #DemDebate,en
BernieSanders,2016-03-07 02:39:16,"Q. Do you support fracking? 
A. No. 
#DebateWithBernie",en
BernieSanders,2016-03-07 02:22:47,"RT @TelemundoNews: #BernieSanders: ""El problema de las drogas es un asunto de salud, no un problema de criminalidad"" #yodecido",es
BernieSanders,2016-03-07 02:16:49,RT @reynoldsjessica: The picture and story of Bernie Sanders getting arrested in Chicago https://t.co/6Z2WWvjHVp #DemDebate https://t.co/9U…,en
BernieSanders,2016-03-07 02:11:19,"RT @MMFlint: Hillary has no clue that the ""auto bailout"" didn't save ONE single job in Flint. We used to have 80,000 GM jobs here. Today? 5…",en
BernieSanders,2016-03-07 02:10:07,RT @BenJealous: Bernie Sanders denouncing the mass incarceration provisions of the crime bill in April of 1994: https://t.co/eOp6TVrBnO #De…,en
BernieSanders,2016-03-07 02:08:41,"RT @RyanLizza: That's a big difference between Clinton WH &amp; Sanders: BS opposed the punitive aspects of the crime bill, while Clinton admin…",en
BernieSanders,2016-03-07 01:53:40,"As Bernie answers this question from Abigail’s father, consider visiting her GoFundMe page to support her family: https://t.co/xdXMGEsTO4",en
BernieSanders,2016-03-07 01:48:42,Boeing is making billions of dollars a year and often pays no income taxes. Why do they need our taxpayer dollars? #DemDebate,en
BernieSanders,2016-03-07 01:48:12,"RT @kartpath: The thing about getting from 90% to 100% is you need a plan to get there. Here’s one from @BernieSanders:
https://t.co/OEKwSP…",en
BernieSanders,2016-03-07 01:47:49,RT @the_intercept: Hillary Clinton made $2.9 million from just 12 speeches to big banks: https://t.co/fK9LZZ4AVt #DemDebate https://t.co/3D…,en
BernieSanders,2016-03-07 01:39:24,"FACT: Bernie Sanders supported the bailout of the auto industry in 2008. #DemDebate
https://t.co/wFltw3Tutf",en
BernieSanders,2016-03-07 01:29:16,"Bernie was one of the first, not one of the last, to oppose the job-killing TPP. #DemDebate
cc: @HillaryClinton",en
BernieSanders,2016-03-07 01:24:10,Tune in to tonight's #DemDebate live and #DebateWthBernie here: https://t.co/kLFADKReGB,en
BernieSanders,2016-03-07 01:19:14,How do we have so much money to go to war in Iraq but somehow not enough money to provide clean drinking water to Flint? #DemDebate,en
BernieSanders,2016-03-07 01:14:12,"At the end of the day, I will trust the people to create a government that works for them, not Corporate America or Wall Street. #DemDebate",en
BernieSanders,2016-03-07 01:12:22,We're glad that @HillaryClinton has finally joined us in calling for Gov. Snyder's resignation. #DemDebate,en
BernieSanders,2016-03-07 01:11:29,Children in America should not be poisoned. The federal government must act. No one should pay a water bill for poisoned water. #DemDebate,en
BernieSanders,2016-03-07 01:08:12,"The governor of Michigan must resign, but more importantly we must take action to help the people of Flint. #DemDebate",en
BernieSanders,2016-03-07 00:50:14,I've said it since day one: I can't do it alone. Watch the #DemDebate and join the conversation. #DebateWithBernie https://t.co/VZYyLrSIMK,en
BernieSanders,2016-03-06 23:37:07,A campaign is not about what you said yesterday. It is about what you have stood for your entire career.,en
BernieSanders,2016-03-06 22:11:05,"I helped write the Affordable Care Act. It's done some great things, but we must do more. 50 million are still uninsured or underinsured.",en
BernieSanders,2016-03-06 21:02:03,"We shouldn't be providing corporate welfare to multi-national corporations through the Export-Import Bank.
https://t.co/hLcJUJju7n",en
BernieSanders,2016-03-06 20:15:04,"Maine, do you know where to caucus today for Bernie? Text ME to 82623 for your location! #GOTVforBernie https://t.co/TlSaSOkHyS",en
BernieSanders,2016-03-06 19:49:45,"This is a sad day for America. Nancy Reagan had a good heart, and she will be dearly missed. https://t.co/IXbgObtjtd",en
BernieSanders,2016-03-06 19:35:04,"It is time for our country to join every other major industrialized nation and guarantee health care to all as a right, not a privilege.",en
BernieSanders,2016-03-06 18:40:08,"America’s radical transformation from a GM economy to a Wal-Mart economy has decimated the middle class. 
https://t.co/yYIRodJVra",en
BernieSanders,2016-03-06 18:14:50,"RT @CNN: ✅ Who: @HillaryClinton &amp; @BernieSanders
✅ What: CNN #DemDebate
✅ When: Tonight at 8p ET
✅ Where: Live from Flint, MI
https://t.co/…",en
BernieSanders,2016-03-06 17:49:03,This campaign is not about me—it's about all of us. No president can accomplish what has to be done unless millions of people come together.,en
BernieSanders,2016-03-06 16:10:26,"We need your help today, Maine! When you caucus, report delegate counts from your location at https://t.co/32SEZ9Nebo.",en
BernieSanders,2016-03-06 15:40:48,"RT @CNN: .@BernieSanders: My proposals ""may be fantasy to the ruling class,"" but not to the working class #CNNSOTU https://t.co/0HJM0Yq2V2",en
BernieSanders,2016-03-06 15:11:03,"U.S. trade policies proved disastrous for Detroit, Flint: https://t.co/yYIRodJVra",en
BernieSanders,2016-03-06 15:10:52,RT @ThisWeekABC: Live now: @BernieSanders joins @GStephanopoulos to discuss #SuperSaturday election results. #ThisWeek https://t.co/Bf40rsH…,en
BernieSanders,2016-03-06 14:34:11,Maine: you vote today. The right to vote is at the heart of freedom and equality in America. Make your voice heard. https://t.co/1RBG2NPY93,en
BernieSanders,2016-03-06 13:02:37,"RT @ThisWeekABC: .@BernieSanders comes to #ThisWeek ahead of tonight's #DemDebate in Flint, Michigan.",en
BernieSanders,2016-03-06 03:35:07,"We’ve got the momentum, the energy and the excitement that will take us all the way to the Democratic National Convention in Philadelphia.",en
BernieSanders,2016-03-06 02:14:09,"Thank you for the strong support, Nebraska! https://t.co/CuXeaQ6lSD",en
BernieSanders,2016-03-06 01:41:46,"Thank you, Kansas! When we started this campaign, no one would have ever expected we’d win. #StandTogether https://t.co/dFc67CVmjq",en
BernieSanders,2016-03-06 01:21:43,I think Governor Snyder should do the right thing and resign. There are no excuses. https://t.co/dWcbeTNIhy,en
BernieSanders,2016-03-06 01:01:16,It's time for the Walton family to pay their workers a living wage and get off of government welfare. https://t.co/UE3GNqRUdm,en
BernieSanders,2016-03-06 00:26:13,"I think if you're gonna get paid $225k for a speech it must be a good speech—Shakespearian. I can't wait to read it.
https://t.co/N86ByFUUZD",en
BernieSanders,2016-03-06 00:14:01,"Tune in live to the Warren, Michigan rally where Bernie will be speaking soon! 
https://t.co/caLtxS66a9 #GOTVforBernie",en
BernieSanders,2016-03-05 23:41:02,"RT @rbecker51: إعلان حملة ""بيرني ساندرز"" باللغة العربية في الإذاعة في ولاية ميشيجان باسم ""فلنقف متضامنين معا"" . صوتوا يوم الثلاثاء https://…",ar
BernieSanders,2016-03-05 23:28:37,Vote or caucus for Bernie to say #iCaucused or #iVoted today to keep the White House! #GOTVforBernie https://t.co/QbVh7Figeg,en
BernieSanders,2016-03-05 22:44:17,ICYMI: Bernie leads Trump at 55 percent to 43 percent and is also leading both Cruz and Rubio by double digits. https://t.co/dXQLv2LycH,en
BernieSanders,2016-03-05 20:50:57,RT @WEWS: WATCH LIVE | @BernieSanders speaks in #Cleveland | https://t.co/sYvP06xx6i https://t.co/SFtlmxKTs9,en
BernieSanders,2016-03-05 20:50:45,"RT @TVNewsLady: Campaign promise: ""I will speak about poverty often and forcibly if I'm elected,"" says @berniesanders at African American T…",en
BernieSanders,2016-03-05 20:32:04,"The right to vote is at the heart of freedom and equality in America, and the effort to suppress it must be met by fierce resistance.",en
BernieSanders,2016-03-05 20:00:46,"We need your help today! When you vote, report delegate counts from your caucuses and turnout from your precincts. https://t.co/hhT0CSbayO",en
BernieSanders,2016-03-05 18:24:03,"A Medicare-for-all plan will save the average middle-class family $5,000 a year.",en
BernieSanders,2016-03-05 17:17:38,"We need your help today! When you vote, report delegate counts from your caucuses and turnout from your precincts. https://t.co/kqG06rfC4h",en
BernieSanders,2016-03-05 17:08:05,"Voting or caucusing for Bernie in KS, LA or NE today? Use #iVoted or #iCaucused and share this image! https://t.co/yfcBOxJXaY",en
BernieSanders,2016-03-05 16:56:04,"I welcome the hatred of the fossil fuel industry. I'm not afraid of them, not afraid of Wall Street and not afraid of corporate America.",en
BernieSanders,2016-03-05 16:24:59,RT @abowersock: Phonebanking WINS elections. Will you join me? #GOTVforBernie #feelthebern https://t.co/yp2DC1wXbd https://t.co/YyW1UoPEgt,en
BernieSanders,2016-03-05 15:46:03,"KS, LA and NE—You vote or caucus today! 
Text VOTE to 82623 to find your polling or caucus location! #GOTVforBERNIE https://t.co/7ClZtChbii",en
BernieSanders,2016-03-05 15:25:48,"RT @KansasForBernie: Last minute information for the KS caucuses!

By tonight, the Political Revolution will have arrived!

#VoteTogether h…",en
