candidate,tweet_time,tweet_text,tweet_lang
BernieSanders,2016-06-23 02:47:58,"RT @DFAaction: State by state, candidates like @EricKingsonNY are working to bring #OurRevolution to Washington. #CNY #UniteBlue https://t.…",en
BernieSanders,2016-06-23 01:56:12,"It is time to expand Social Security, not cut it.
https://t.co/aFr9lAeVeH",en
BernieSanders,2016-06-23 00:43:08,The Republican Party now controls both the governors’ mansions and statehouses in 23 states. That is just unacceptable.,en
BernieSanders,2016-06-22 23:12:35,Call voters for @ZephyrTeachout: https://t.co/jrXadEwn7c https://t.co/akDLHhSlZI,en
BernieSanders,2016-06-22 23:02:04,Election days come and go. But political and social revolutions that attempt to transform our society never end. https://t.co/yatrzcdJIg,en
BernieSanders,2016-06-22 22:36:05,"RT @scottbix: Thirty-one years ago, @BernieSanders proclaimed ""Gay Pride Day"" in Burlington. https://t.co/6WzHRicuDr",en
BernieSanders,2016-06-22 21:22:09,".@realDonaldTrump's agenda of tax cuts for the rich, lower wages and divisive, bigoted rhetoric is contrary to everything we stand for.",en
BernieSanders,2016-06-22 20:51:02,We must aggressively combat climate change by moving to energy efficiency and sustainable energy and imposing a tax on carbon.,en
BernieSanders,2016-06-22 17:11:03,RT @NALEO: Democratic Presidential Candidate @BernieSanders to Address #NALEOConf16 in Washington D.C. https://t.co/7DeJRI6fnM https://t.co…,en
BernieSanders,2016-06-22 17:04:57,"This is the energy we need to transform the Democratic Party, take on special interests and transform our country.
https://t.co/IG1pLCVTxh",en
BernieSanders,2016-06-22 16:02:06,The Democratic Party needs a 50-state strategy. We may not win in every state tomorrow but we must provide resources to these states.,en
BernieSanders,2016-06-22 13:49:02,"Sadly, the current Democratic leadership has turned its back on dozens of states and allowed right-wing politicians to win elections.",en
BernieSanders,2016-06-22 00:12:01,"We must resist all efforts to cut Social Security. Instead, we've gotta fight to expand benefits for our seniors and disabled veterans.",en
BernieSanders,2016-06-21 22:32:06,"The greed, recklessness and illegal behavior on Wall Street has got to end. It's up to us to end it for them.",en
BernieSanders,2016-06-21 20:48:02,We must defeat the Trans-Pacific Partnership and make certain that it does not get a vote in a lame-duck session of Congress.,en
BernieSanders,2016-06-21 19:21:01,"From Flint, Michigan to California we have communities unable to drink the polluted water that comes out of their faucets. In the year 2016.",en
BernieSanders,2016-06-21 17:27:04,The reality is that today millions of our fellow Americans are working at starvation wages.,en
BernieSanders,2016-06-21 15:42:02,Our brave young men and women in the military should not thrown into perpetual warfare in wars we should not be fighting.,en
BernieSanders,2016-06-21 13:57:07,"Health care is a right, not a privilege. It's time for the United States to implement a single-payer system like Medicare for all.",en
BernieSanders,2016-06-21 01:57:05,We must ban fracking if we want to protect our water supply.,en
BernieSanders,2016-06-21 00:20:15,"It’s not very hard to understand that potential terrorists, criminals and the dangerously mentally ill should not have access to guns.",en
BernieSanders,2016-06-21 00:19:31,These proposals are commonsense. It is incomprehensible as to why Republicans would oppose them. #DisarmHate  https://t.co/Led5kKKQy6,en
BernieSanders,2016-06-20 23:51:01,America has always been a beacon of hope for those fleeing violence and persecution. We cannot turn our backs on refugees. #WorldRefugeeDay,en
BernieSanders,2016-06-20 22:30:52,Our welcoming nature has been a point of pride for decades: we believe in helping all refugees from around the world. #WorldRefugeeDay,en
BernieSanders,2016-06-20 20:52:05,We can't allow guns to fall into the hands of people who shouldn't have them and that includes those on the terror watch list.,en
BernieSanders,2016-06-20 20:14:03,It's long past time to end the gun show loophole and expand instant background checks.,en
BernieSanders,2016-06-20 18:48:03,"Today, millions of bright young kids are struggling with suffocating levels of student debt. As a nation we must end that disgrace.",en
BernieSanders,2016-06-20 17:40:08,"RT @Tim_Canova: I’m Tim Canova and I’m challenging Wasserman Schultz in the Democratic primary for Florida’s 23rd district. AMA!
https://t.…",en
BernieSanders,2016-06-20 17:07:03,Why is it that in the richest country on earth we are experiencing the highest level of childhood poverty of almost any major country?,en
BernieSanders,2016-06-20 15:47:03,Real change happens when tens of millions of people say “enough is enough” and become engaged in the fight for justice.,en
BernieSanders,2016-06-20 13:47:05,Today the 20 wealthiest people own more wealth than the bottom 150 million. We must end this grotesque level of income inequality.,en
BernieSanders,2016-06-20 01:13:03,Why is it that our Native American brothers and sisters on some reservations have a life expectancy lower than many third-world countries?,en
BernieSanders,2016-06-19 22:43:03,It is a disgrace that hundreds of thousands of bright young people are unable to go to college because their families lack the income.,en
BernieSanders,2016-06-19 20:25:28,Happy Fathers Day! https://t.co/uSJeaUAFG0,en
BernieSanders,2016-06-19 17:51:45,"We must resist efforts to cut Social Security and, in fact, expand benefits for our seniors and disabled veterans.
https://t.co/1nEQsCflB4",en
BernieSanders,2016-06-19 14:24:04,"In many inner cities, kids now stand a greater chance of ending up in jail than ending up with a college degree. That's gotta end.",en
BernieSanders,2016-06-18 22:52:07,We must compete effectively in a global economy by making public colleges and universities tuition-free.,en
BernieSanders,2016-06-18 21:27:44,We must end the disgrace of having more people in jail than any other country on earth and move toward real criminal justice reform.,en
BernieSanders,2016-06-18 19:48:21,We must join the rest of the industrialized world and guarantee health care to all people as a right and not a privilege.,en
BernieSanders,2016-06-18 17:22:35,Current leadership has allowed right-wing politicians to win elections in some states with virtually no opposition. https://t.co/2YY2aZ5jOz,en
BernieSanders,2016-06-18 16:51:31,We must pass comprehensive immigration reform and provide a path toward citizenship for 11 million undocumented people.,en
BernieSanders,2016-06-18 01:22:06,We must ensure that women will no longer make 79 cents on the dollar compared to men and that we fight for pay equity.,en
BernieSanders,2016-06-17 23:58:05,We must fight to make certain that women throughout the country have the right to control their own bodies.,en
BernieSanders,2016-06-17 22:53:35,"Bernie supporters want to run for office in: 
🐦 51% of state house districts 
🐦 69% of state senate districts &amp;
🐦 every U.S. House district.",en
BernieSanders,2016-06-17 20:12:02,"If we are serious about criminal justice reform, we must remove marijuana from the federal Controlled Substances Act.",en
BernieSanders,2016-06-17 18:39:05,I find it strange that the kid who smokes marijuana gets arrested but the crooks on Wall Street get off scot free.,en
BernieSanders,2016-06-17 17:24:14,"As I have said throughout this campaign, the Democratic Party must support raising the federal minimum wage to $15 an hour.",en
BernieSanders,2016-06-17 16:04:48,"We must ban the sale and distribution of assault weapons, end the gun show loophole and expand instant background checks.",en
BernieSanders,2016-06-17 00:53:59,My hope is that when future historians look back on the campaign of 2016 they will say that is where it all began. Thank you #OurRevolution,en
BernieSanders,2016-06-17 00:49:33,Please go to my website at https://t.co/IsNuum2y5X to learn more about how you can effectively run for office. #OurRevolution,en
BernieSanders,2016-06-17 00:48:49,We must start engaging at the local and state level in an unprecedented way. #OurRevolution https://t.co/8ZxfQ2APRD,en
BernieSanders,2016-06-17 00:48:25,"Fact: Since 2009, some 900 legislative seats have been lost to Republicans in state after state. #OurRevolution https://t.co/a7EBJLSRsl",en
BernieSanders,2016-06-17 00:46:49,The political revolution means more than fighting for our ideals at the Democratic National Convention and defeating Trump. #OurRevolution,en
BernieSanders,2016-06-17 00:42:17,I look forward to working with @HillaryClinton in the coming weeks. https://t.co/f5zcVRgfnv,en
BernieSanders,2016-06-17 00:40:53,"This campaign is about defeating @realDonaldTrump, the Republican candidate for president. #OurRevolution https://t.co/exfWylcYbd",en
BernieSanders,2016-06-17 00:40:22,This campaign has never been about any single candidate. It is about transforming America. #OurRevolution,en
BernieSanders,2016-06-17 00:36:12,"Special thanks to the students struggling with loans, seniors on Social Security, workers earning low wages &amp; the unemployed. #OurRevolution",en
BernieSanders,2016-06-17 00:35:19,"Unprecedented: 
✅ 2.7 million people donated to our movement 
✅ with over 8 million contributions
✅ at an average of $27.
#OurRevolution",en
BernieSanders,2016-06-17 00:34:40,Something extraordinarily important happened in this campaign – something that I had not anticipated. #OurRevolution https://t.co/SVhldvMZXZ,en
BernieSanders,2016-06-17 00:32:49,RT @YouTube: [LIVE] @BernieSanders addresses his supporters to discuss the road ahead. https://t.co/w7TRmEHq02 https://t.co/Ht02sNv2WT,en
BernieSanders,2016-06-17 00:32:22,When we began this campaign nobody thought we were going anywhere. A lot has changed. #OurRevolution https://t.co/pWuRwpyoYo,en
BernieSanders,2016-06-17 00:31:34,The political revolution must continue into the future. #OurRevolution https://t.co/2vrUatxx9U,en
BernieSanders,2016-06-17 00:30:37,Election days come and go. But political revolutions that attempt to transform our society never end. #OurRevolution https://t.co/VnFvnkT2es,en
BernieSanders,2016-06-16 23:59:40,#OurRevolution continues tonight with Bernie Sanders' live online address to his supporters at 8:30 pm ET. https://t.co/m6S1VVcZRj,en
BernieSanders,2016-06-16 21:43:09,You should not be able to walk into a gun store and purchase assault weapons. These type of weapons should be banned.,en
BernieSanders,2016-06-16 20:01:03,"In just a few hours I will speak to my supporters in an online video address. I very much hope that you'll join us:
https://t.co/i9tIJnfWjR",en
BernieSanders,2016-06-16 18:43:04,Over 15 million children in America today are poor — more than 20 percent of all of the kids living in America today.,en
BernieSanders,2016-06-16 17:05:04,"Almost every country in the world has at least 10 days of paid vacation per year, except the United States.",en
BernieSanders,2016-06-16 15:45:23,It is a national disgrace that billionaires are able to heavily influence the political process by making huge contributions.,en
BernieSanders,2016-06-16 14:34:16,"Millions of Americans are working longer hours for lower wages. They are overworked, underpaid and under enormous stress.",en
BernieSanders,2016-06-16 02:15:25,"The future of our political revolution depends on you. Will you join us for a live online, video address? 
https://t.co/XqTY09dLQx",en
BernieSanders,2016-06-16 00:08:52,This movement is sending a message to the billionaire class: You can’t have it all. This is our country too.,en
BernieSanders,2016-06-15 20:29:38,"In my view, every worker in America should be guaranteed at least twelve weeks of paid family and medical leave.",en
BernieSanders,2016-06-15 20:20:46,"RT @BernieSanders: No president can do it alone. That's why I'm endorsing progressives Rep. @RepMarcyKaptur and Rep. @RickNolanmn.
https://…",en
BernieSanders,2016-06-15 20:20:38,RT @DavidFBowen: RSVP to hear Bernie's live video address tomorrow: https://t.co/d3otYjXSIr &gt;Goal always must be something bigger than your…,en
BernieSanders,2016-06-15 16:22:02,We need real reform within the Democratic Party. And that means open primaries.,en
BernieSanders,2016-06-15 14:52:03,The idea that in the State of New York 3 million people could not participate in helping select the Democratic nominee is incomprehensible.,en
BernieSanders,2016-06-15 13:08:02,The political revolution continues. Join us on Thursday to discuss what's next: https://t.co/YXwiHtk1i2,en
BernieSanders,2016-06-15 03:06:17,Thank you to everyone in D.C. who went out to vote and thank you all for your support!,en
BernieSanders,2016-06-15 00:43:06,"We know that one hateful person committed a heinous crime, not an entire people. To blame an entire religion is nothing less than bigotry.",en
BernieSanders,2016-06-14 23:36:05,"These types of weapons, without a doubt, should be banned.",en
BernieSanders,2016-06-14 23:33:06,The idea that weapons designed to do one thing – kill people by the dozens – should be sold and distributed in our country is absurd.,en
BernieSanders,2016-06-14 21:59:04,Vote to help move this country in a different direction. Polls are open until 8 PM. https://t.co/dT4rgujx64,en
BernieSanders,2016-06-14 21:26:07,We must get rid of superdelegates. The fact that we had 400 superdelegates pledged eight months before the first ballot was cast is absurd.,en
BernieSanders,2016-06-14 21:15:04,We have to replace the current DNC leadership. We need someone who vigorously supports bringing people into the political process.,en
BernieSanders,2016-06-14 20:56:04,"This decision ensures that big corporations will not be able to put a price tag on the free flow of ideas.
https://t.co/aQewcUrdHf",en
BernieSanders,2016-06-14 20:39:17,RT @penningtonkm: Join @BernieSanders and tens of thousands of volunteers and supporters for a national address Thursday at 8:30pm ET: http…,en
BernieSanders,2016-06-14 19:11:13,RT @ABCPolitics: WATCH LIVE: @BernieSanders holds press conference in Washington D.C. https://t.co/5VGIYIGv44 https://t.co/cqJ556K3D6,en
BernieSanders,2016-06-14 18:47:07,"We know that one hateful person committed this terrible crime — not an entire people or an entire religion. 
https://t.co/emr7EPkQr4",en
BernieSanders,2016-06-14 16:49:07,The political revolution continues. Bernie will address supporters on Thursday. Sign up for the live stream: https://t.co/DotMViqQnq,en
BernieSanders,2016-06-14 16:39:05,Everyone who votes in the D.C. primary will make a difference. Do you have a voting plan today? https://t.co/dtbBI5X3nv,en
BernieSanders,2016-06-14 15:06:32,"Nevada – send the message today that yes, we are going to move this country in a progressive direction. Go vote.  https://t.co/WGkai4Y3yW",en
BernieSanders,2016-06-14 14:07:28,"RT @Marcy_Kaptur: Thank you @BernieSanders. Honored to fight alongside you against NAFTA, Iraq war, and the Wall Street Bailout.   https://…",en
BernieSanders,2016-06-14 12:39:05,"Make our country work for everyone, not just a handful of billionaires. Let’s bring it home. Washington, D.C. – go vote. #FeelTheBern",en
BernieSanders,2016-06-14 01:54:58,"My plan: break up big banks, close tax loopholes and make them pay their fair share. Then we can expand health care and make college free.",en
BernieSanders,2016-06-13 23:56:10,"RT @LaurenBlanch12: . @BernieSanders stands with faith leaders of Burlington, VT. Event organized by Pride Center of Vermont https://t.co/L…",en
BernieSanders,2016-06-13 23:55:57,"RT @JackNECN: &gt;@BernieSanders tells hometown crowd ""one hateful person committed this crime -- not an entire religion."" #VT https://t.co/Ox…",en
BernieSanders,2016-06-13 21:12:06,"Washington, D.C. – On Tuesday, June 14, you will have the chance to stand up and be heard. https://t.co/7EDOnzjv1o",en
BernieSanders,2016-06-13 19:23:07,It is an embarrassment that some politicians refuse to recognize the reality of climate change.,en
BernieSanders,2016-06-13 17:02:08,"No president can do it alone. That's why I'm endorsing progressives Rep. @RepMarcyKaptur and Rep. @RickNolanmn.
https://t.co/cJ2qSwDr56",en
BernieSanders,2016-06-13 15:07:32,"Washington, D.C.'s primary takes place tomorrow, June 14 – the last one of this presidential nominating process.
https://t.co/Q7xCvTBkuZ",en
BernieSanders,2016-06-13 13:06:01,"It is morally wrong that Washington, D.C.'s residents lack voting representation in Congress.
https://t.co/7YhCiqcRQD",en
BernieSanders,2016-06-13 01:58:31,"From what is now known, this was a terrorist act by an ISIS sympathizer. That despicable and barbaric organization must be destroyed.",en
BernieSanders,2016-06-12 18:57:13,"All Americans are horrified, disgusted and saddened by the horrific atrocity in Orlando. Full statement: https://t.co/ci5kxXKSyZ",en
BernieSanders,2016-06-12 14:08:03,"RT @NBCNewsPR: ""It's horrific, it's unthinkable,"" says @BernieSanders on #OrlandoShooting this morning on @MeetThePress. #MTP #Orlando",en
BernieSanders,2016-06-12 01:02:05,"Some of us believe that what God teaches is to not turn our backs on our brothers and our sisters, that essentially we are in this together.",en
BernieSanders,2016-06-11 22:26:04,"Our economy works for Wall Street because it’s rigged by Wall Street. As long as Washington's bought, our economy won't work for the people.",en
BernieSanders,2016-06-11 20:35:07,Universal health care is an idea that has been supported by Democratic presidents going back to Franklin Roosevelt and Harry Truman.,en
BernieSanders,2016-06-11 17:47:01,"We must lead the world in working with China, Russia, India and the international community to break our energy dependence on fossil fuel.",en
BernieSanders,2016-06-11 15:22:06,"Millions of lives are being wrecked, families are being torn apart and we are spending huge sums of taxpayer money by locking people up.",en
BernieSanders,2016-06-11 13:21:03,"We must not succumb to bigotry. We must do what we do best as Americans – fight racism, fight xenophobia and fight fear.",en
BernieSanders,2016-06-11 01:02:01,"A job must lift workers out of poverty, not keep them in it. The current federal minimum wage of $7.25 an hour is a starvation wage.",en
BernieSanders,2016-06-10 23:32:04,We cannot continue to send our jobs to China and other low-wage countries when millions of Americans need work.,en
BernieSanders,2016-06-10 22:16:07,"More than one-third of our senior citizens rely on Social Security for virtually all of their income. We must expand benefits, not cut them.",en
BernieSanders,2016-06-10 22:01:21,RT @CNNSotu: This Sunday on #CNNSOTU: @BernieSanders joins @jaketapper just days after meeting with President Obama. https://t.co/yUh9VW96Cr,en
BernieSanders,2016-06-10 20:46:04,We must end the over-incarceration of nonviolent Americans in our country.,en
BernieSanders,2016-06-10 19:00:38,"Instead of cutting head start and childcare, we need to move to a universal pre-K system for all children. https://t.co/cFyFwA09Vb",en
BernieSanders,2016-06-10 16:55:15,RT @GunnelsWarren: I don’t think that we can amend or tinker around the edges with the Trans-Pacific Partnership. We need to kill it. https…,en
BernieSanders,2016-06-10 16:22:54,It is not good enough to talk about public education being kindergarten to 12th grade anymore. We need to make public colleges tuition-free.,en
BernieSanders,2016-06-10 14:01:42,"Our job is to bring the American people together to create a government that works for us, not the 1 percent.",en
BernieSanders,2016-06-09 23:10:31,"RT @cspan: .@BernieSanders campaigns in Washington, DC – LIVE shortly on C-SPAN3 https://t.co/JndHhNdEbe https://t.co/2k4HH3Ud9A",en
BernieSanders,2016-06-09 16:27:05,But you all know it is more than Bernie Sanders. It is all of us together. Millions of people from coast to coast coming together.,en
BernieSanders,2016-06-09 14:48:04,"When millions of Americans are working longer hours for lower wages, we won't allow 57 percent of all new income to go to the top 1 percent.",en
BernieSanders,2016-06-09 14:46:54,I'm horrified by yesterday's terrorist attack in Tel Aviv. My thoughts are with the victims' families and all of those harmed.,en
BernieSanders,2016-06-09 13:06:05,The American people know that it is not acceptable that the top tenth of 1 percent owns as much wealth as the bottom 90 percent.,en
BernieSanders,2016-06-09 01:22:05,Our mission is more than just defeating Trump. It is transforming our country. People want something to vote for rather than just against.,en
BernieSanders,2016-06-08 23:12:06,The American people will never support a candidate whose major theme is bigotry. We will not allow Donald Trump to become president.,en
BernieSanders,2016-06-08 21:02:05,We will not allow right-wing Republicans to control our government. That is especially true with Donald Trump as the Republican candidate.,en
BernieSanders,2016-06-08 19:56:01,"Young people understand that they are the future of America, and they intend to help shape that future.",en
BernieSanders,2016-06-08 18:41:06,"We have won 22 state elections with over 11 million votes and in virtually every state, we've won in big numbers the votes of young people.",en
BernieSanders,2016-06-08 17:57:33,"When we began this campaign we were considered to be a fringe campaign. Over the last year, I think that has changed just a little bit.",en
BernieSanders,2016-06-08 14:57:17,"We must always remember that change almost never happens from the top down, it happens from the bottom up.",en
BernieSanders,2016-06-08 06:09:45,"We are in this TOGETHER. Thank you New Mexico, California, South Dakota, North Dakota, New Jersey and Montana! #NotMeUs",en
BernieSanders,2016-06-08 06:07:49,Montana – Thank you all. The struggle continues! https://t.co/NM2H80ZEGG,en
BernieSanders,2016-06-08 05:44:28,RT @MSNBC: WATCH LIVE: Bernie Sanders addresses California supporters on primary night https://t.co/Boajkfc2D7 #Decision2016,en
BernieSanders,2016-06-08 03:00:54,Thank you to the thousands of supporters who came out to vote for the political revolution in New Jersey today!,en
BernieSanders,2016-06-08 02:35:55,Thank you North Dakota! https://t.co/1FMVeH7GMh,en
BernieSanders,2016-06-07 23:07:12,You still have time to run to your voting location before polls close. Get out and vote! #PrimaryDay https://t.co/e4k48x9Qth,en
BernieSanders,2016-06-07 22:51:34,"We need your help to win in CA, ND, SD, MT, NJ and NM today! Make calls to voters now: https://t.co/aTpBHlAr7O",en
BernieSanders,2016-06-07 22:31:08,"North Dakota: today we caucus. Get to your caucus by 7 pm. If there's a large voter turnout, we will win. Join history in the making.",en
BernieSanders,2016-06-07 21:48:34,"Mis profundas condolencias a la familia Chávez ante el fallecimiento de Helen Chávez, gran líder y defensora de los trabajadores del campo.",es
BernieSanders,2016-06-07 21:33:20,"My profound condolences to the Chávez family on the passing of Helen Chávez, great leader and activist for farmworker's rights. #SiSePuede",en
BernieSanders,2016-06-07 20:26:02,Defy the pundits again and reach for a high voter turnout that'll shock the establishment. Grab your friends and go vote. #PrimaryDay,en
BernieSanders,2016-06-07 19:29:04,I'm asking you to support strong progressive allies like @EricKingsonNY and @Clem4Congress. Help elect them: https://t.co/hNvGMCUEfe,en
BernieSanders,2016-06-07 18:49:07,California: Hoy el establecimiento no podrá ignorar tu voz. Vota por nuestro movimiento. ¿Preguntas? Llámanos. https://t.co/Nz9Og9PRwE,es
BernieSanders,2016-06-07 18:29:08,California: send the establishment a message they can’t ignore. Vote for our movement. Questions? Call our hotline. https://t.co/vR3GTV2yUV,en
BernieSanders,2016-06-07 16:40:22,"California, Montana, New Jersey, New Mexico, South Dakota and North Dakota – your turn to vote for the revolution! https://t.co/cyqk7tRNxR",en
BernieSanders,2016-06-07 15:32:03,Pundits and the political press wanna call this race early before every person votes. Let's show them we ain't gonna let it happen. Go vote.,en
BernieSanders,2016-06-07 14:56:07,"California – today you can send a message that this country belongs to all of us, not just a handful of billionaires. Go vote. #PrimaryDay",en
BernieSanders,2016-06-07 14:18:38,Montana: your polls are open. Don't settle for a rigged economy held in place by a corrupt campaign finance system. Vote Bernie! #PrimaryDay,en
BernieSanders,2016-06-07 13:25:05,"New Mexico – your polls are open until 7 PM. Go out and vote for REAL CHANGE, not the same old, same old establishment politics. #PrimaryDay",en
BernieSanders,2016-06-07 12:34:53,South Dakota and New Jersey – your polls are open. Show the country that it is too late for establishment politics. Please go vote.,en
BernieSanders,2016-06-07 02:09:08,"California – you vote tomorrow, June 7. Questions or issues? Call or email our hotline. https://t.co/imRyCL6lF6",en
BernieSanders,2016-06-07 01:04:02,"CA, MT, NJ, NM, SD and ND: are you ready to vote tomorrow? Find your voting location: https://t.co/QvV30FsiaA",en
BernieSanders,2016-06-07 00:03:34,I am running for president because it is too late for establishment politics and too late for establishment economics. We need real change.,en
BernieSanders,2016-06-06 21:56:02,Ready for a political revolution? Get out and vote tomorrow! Text VOTE to 82623 for voting information. https://t.co/0nUN8V97fV,en
BernieSanders,2016-06-06 20:23:05,"We must recreate our criminal justice system, but we cannot do that as long as corporations are allowed to profit from mass incarceration.",en
